{
  "$schema": "https://json-schema.org/draft/2020-12/schema",
  "type": "object",
  "properties": {
    "currency": {
      "type": "string",
      "const": "USD"
    },
    "totalContractValue": {
      "type": "string"
    },
    "upfront": {
      "type": "string"
    },
    "recurring": {
      "type": "string"
    },
    "quoteExpiry": {
      "type": "string"
    },
    "scopeLocations": {
      "type": "integer",
      "minimum": 1,
      "maximum": 9007199254740991
    },
    "termMonths": {
      "type": "integer",
      "minimum": 1,
      "maximum": 9007199254740991
    },
    "destination": {
      "type": "string"
    },
    "explanation": {
      "type": "string"
    }
  },
  "required": [
    "currency",
    "totalContractValue",
    "upfront",
    "recurring",
    "quoteExpiry",
    "scopeLocations",
    "termMonths",
    "destination",
    "explanation"
  ],
  "additionalProperties": false
}
